{
  "state_version": "2.0",
  "exam_key": "fixture.cert|v1|stage1|pt|BR",
  "profile_version": "fixture.profile.revision1",
  "domain_id": "fixture.domain",
  "state": "P",
  "origin": "measured",
  "confidence": "provisional",
  "evidence_ids": [],
  "applied_event_ids": [
    "fixture.event"
  ],
  "learned_at": null,
  "next_due": null,
  "review_intervals_days": [
    1,
    3,
    7,
    14,
    30,
    60
  ],
  "cycles_without_gain": 0,
  "missing_data": [
    "amostra de domínio"
  ]
}
